company_name,industry,location,partners,person_quoted,product_url,region
Rainmaker,Business process outsourcer,Finland and Spain,,"Henri Forss, Sales and Development Director, Rainmaker",https://www.genesys.com/customer-stories/rainmaker/,EMEA
The University of Texas Rio Grande Valley,Higher education,US,,"Dr. Vanessa Maldonado, Director of Student Service Centers, UTRGV",https://www.genesys.com/customer-stories/the-university-of-texas-rio-grande-valley/,
Metergy Solutions,Utilities,Canada,,"Maudrie Smith, Director of Customer Care Operations, Metergy Solutions",https://www.genesys.com/customer-stories/metergy/,
Farmers Mutual Group (FMG),Insurance,New Zealand,"['Avtex', 'Microsoft']","Matt Harvey, Head of National Advice and Service Center, FMG",https://www.genesys.com/customer-stories/farmers-mutual-group/,APAC
Aeromexico,Airline,Mexico,"['Salesforce', 'Pureinsights', 'Kranon']","Angelina Griselda Stankiewicz Chávez, Senior Contact Center Manager, Aeromexico",https://www.genesys.com/customer-stories/aeromexico/,LATAM
TechStyleOS,Retail,US and global,['Amazon Web Services'],"Jack Roberts, Director, GMS Technology and Applications , TechStyleOS",https://www.genesys.com/customer-stories/techstyleos/,
Etraveli Group,Travel and tourism,Sweden,"['GlobalConnect', 'Amelia', 'Scorebuddy', 'Shelf']","Gurpreet Sawhney, WFM Director, Etraveli Group",https://www.genesys.com/customer-stories/etraveli/,EMEA
