,company_name,industry,location,partners,person_quoted,product_url,region,Person Name,Role in Company
128,Somerset Council,Local government,UK,"['Kerv', 'Amazon Web Services']","Sharon Passmore, Service Manager, Customer Services, Somerset Council",https://www.genesys.com/customer-stories/somerset-council/,EMEA,Sharon Passmore, Service Manager
129,"Edenred Brazil — Ticket Log, Repom and Edenred Pay brands",Payment services,Brazil,"['Alctel', 'IBM']","Jéssica Mallach, Continual Improvement Coordinator, Ticket Log",https://www.genesys.com/customer-stories/edenred-brazil/,LATAM,Jéssica Mallach, Continual Improvement Coordinator
130,,Insurance,Australia,"['Telstra', 'CVT']","Sheridan Francis, Manager, Regional Operations Center, Aioi Nissay Dowa Insurance Company Australia",https://www.genesys.com/customer-stories/aioi-nissay-dowa-insurance/,APAC,Sheridan Francis, Manager
131,,,,,,https://www.genesys.com/customer-stories/kiwi-com/,EMEA,,
132,,,,,,https://www.genesys.com/customer-stories/gaitame-com/,APAC,,
133,Localsearch,Digital marketing,Australia,,"Gary Mandelkow, Chief Technology Officer, Localsearch",https://www.genesys.com/customer-stories/localsearch/,APAC,Gary Mandelkow, Chief Technology Officer
134,Hexaware,IT/Business process outsourcer,India,,"Kalpesh Gandhi, VP of OCX Service Delivery, Hexaware",https://www.genesys.com/customer-stories/hexaware/,APAC,Kalpesh Gandhi, VP of OCX Service Delivery
135,Countdown New Zealand,Retail,New Zealand,,"Steve James, Head of Technology, Countdown New Zealand",https://www.genesys.com/customer-stories/countdown-new-zealand/,APAC,Steve James, Head of Technology
136,Arvato CRM Solutions,Customer Services and Business Process Outsourcing,UK,['Kerv'],"Gordon Dalgleish, Head of IT Solutions, Arvato CRM Solutions",https://www.genesys.com/customer-stories/arvato/,EMEA,Gordon Dalgleish, Head of IT Solutions
137,Prvidr,Software,Australia,,"Lawrence Drayton, Head of Customer Experience, Prvidr",https://www.genesys.com/customer-stories/prvidr/,APAC,Lawrence Drayton, Head of Customer Experience
138,Eesti Energia (also known as Enefit),Energy,"Estonia, Latvia, Lithuania, Poland and Finland",['Adventus Solutions'],"Kaido Kabral, Customer Service Solution Expert, Eesti Energia",https://www.genesys.com/customer-stories/eesti-energia/,EMEA,Kaido Kabral, Customer Service Solution Expert
139,Maxicare,Healthcare,Philippines,,"Christian Argos, CEO, Maxicare",https://www.genesys.com/customer-stories/maxicare/,APAC,Christian Argos, CEO
140,BetFlag,Online gambling,Italy,['TechneValue'],"Domenico Galizia, CEO, BetFlag",https://www.genesys.com/customer-stories/betflag/,EMEA,Domenico Galizia, CEO
141,3 Denmark,Telecommunications,Denmark,['Advania'],"Jonas Kristensen, Business Optimisation Manager, 3 Denmark",https://www.genesys.com/customer-stories/3-denmark/,EMEA,Jonas Kristensen, Business Optimisation Manager
142,BancoEstado,Financial services,Chile,,"Luis Chávez Tuesta, Head of Software and Product Development, BancoEstado",https://www.genesys.com/customer-stories/bancoestado/,LATAM,Luis Chávez Tuesta, Head of Software and Product Development
143,Multilaser,Manufacturing and retail,Brazil,['Survey Dynamix'],"Leonardo Castilho, Head eCommerce, After-sales and Digital Marketing, Multilaser",https://www.genesys.com/customer-stories/multilaser/,LATAM,Leonardo Castilho, Head eCommerce
144,eco24,Debt consulting,Germany,['Deliberate'],"Hans-Jörg Fadda, Managing Director, eco24",https://www.genesys.com/customer-stories/eco24/,EMEA,Hans-Jörg Fadda, Managing Director
145,Maximus,Business process outsourcer,US with global operations,['Amazon Web Services'],"Angela Kovach, Vice President of Cloud Technology, Maximus",https://www.genesys.com/customer-stories/maximus/,,Angela Kovach, Vice President of Cloud Technology
146,Beyond Bank,Financial services,Australia,['QPC'],"Brent Alexander, National Manager, Customer Relationship Center, Beyond Bank",https://www.genesys.com/customer-stories/beyond-bank/,APAC,Brent Alexander, National Manager
147,O.phon GmbH,Business consulting services,Germany,['NTT'],"Daniel Kubein, Head of Operations and Performance, O.phon GmbH",https://www.genesys.com/customer-stories/o-phon/,EMEA,Daniel Kubein, Head of Operations and Performance
148,Dolfi1920,Aviation,Poland,,"Tal Fridman, Operations and Business Development Director Europe, Dolfi1920",https://www.genesys.com/customer-stories/dolfi1920/,EMEA,Tal Fridman, Operations and Business Development Director Europe
149,Grupo Sabin,Healthcare,Brazil,['InvenIT'],"Neilton Alves, Project Analyst, Grupo Sabin",https://www.genesys.com/customer-stories/grupo-sabin/,LATAM,Neilton Alves, Project Analyst
150,Inter,Financial Services,Brazil,,"João Marcus Santos, IT Manager, Inter",https://www.genesys.com/customer-stories/inter/,LATAM,João Marcus Santos, IT Manager
151,Odity,Customer relations,Global,,"Clément Polet, Deputy CEO Business, Odity",https://www.genesys.com/customer-stories/odity/,EMEA,Clément Polet, Deputy CEO Business
152,Digital Dialog GmbH,Contact center services,Germany,['VR Voice'],"Corinna Kaussen, Authorized Signatory, Digital Dialog GmbH",https://www.genesys.com/customer-stories/digital-dialog/,EMEA,Corinna Kaussen, Authorized Signatory
153,Company Nurse,Healthcare,US,['Brightmetrics'],"Henry Svendblad, CTO, Company Nurse",https://www.genesys.com/customer-stories/company-nurse/,,Henry Svendblad, CTO
154,APM,Human resources,Australia,['Customer Driven'],"Michael McBride, General Manager, Customer Service Center, APM",https://www.genesys.com/customer-stories/apm/,APAC,Michael McBride, General Manager
155,,,,,,https://www.genesys.com/customer-stories/rapid-financial-solutions/,,,
156,Brighton & Hove Albion Football Club,Sports and entertainment,UK,['Kerv'],"Brian Kearney, Digital Systems Project Manager, Brighton & Hove Albion Football Club",https://www.genesys.com/customer-stories/brighton-and-hove-albion-football-club/,EMEA,Brian Kearney, Digital Systems Project Manager
157,Universidad Tecnologica de México (UNITEC),Education,Mexico,,"Leandro Cruz Hernández, Digital Director and Customer Experience, UNITEC",https://www.genesys.com/customer-stories/unitec/,LATAM,Leandro Cruz Hernández, Digital Director and Customer Experience
158,Rainmaker,Business process outsourcer,Finland and Spain,,"Henri Forss, Sales and Development Director, Rainmaker",https://www.genesys.com/customer-stories/rainmaker/,EMEA,Henri Forss, Sales and Development Director
159,The University of Texas Rio Grande Valley,Higher education,US,,"Dr. Vanessa Maldonado, Director of Student Service Centers, UTRGV",https://www.genesys.com/customer-stories/the-university-of-texas-rio-grande-valley/,,Dr. Vanessa Maldonado, Director of Student Service Centers
160,Metergy Solutions,Utilities,Canada,,"Maudrie Smith, Director of Customer Care Operations, Metergy Solutions",https://www.genesys.com/customer-stories/metergy/,,Maudrie Smith, Director of Customer Care Operations
161,Farmers Mutual Group (FMG),Insurance,New Zealand,"['Avtex', 'Microsoft']","Matt Harvey, Head of National Advice and Service Center, FMG",https://www.genesys.com/customer-stories/farmers-mutual-group/,APAC,Matt Harvey, Head of National Advice and Service Center
162,Aeromexico,Airline,Mexico,"['Salesforce', 'Pureinsights', 'Kranon']","Angelina Griselda Stankiewicz Chávez, Senior Contact Center Manager, Aeromexico",https://www.genesys.com/customer-stories/aeromexico/,LATAM,Angelina Griselda Stankiewicz Chávez, Senior Contact Center Manager
163,TechStyleOS,Retail,US and global,['Amazon Web Services'],"Jack Roberts, Director, GMS Technology and Applications , TechStyleOS",https://www.genesys.com/customer-stories/techstyleos/,,Jack Roberts, Director
164,Etraveli Group,Travel and tourism,Sweden,"['GlobalConnect', 'Amelia', 'Scorebuddy', 'Shelf']","Gurpreet Sawhney, WFM Director, Etraveli Group",https://www.genesys.com/customer-stories/etraveli/,EMEA,Gurpreet Sawhney, WFM Director
