company_name,industry,location,partners,person_quoted,product_url,region
TSB Bank Limited,Financial services,New Zealand,,"Lisa Macnee, Head of Digital and Customer Engagement Center, TSB Bank Ltd",https://www.genesys.com/customer-stories/tsb-bank/,APAC
ConTe.it,Insurance,Italy,,"Francesco Del Gallo, Product Manager, ConTe.it",https://www.genesys.com/customer-stories/conte-it/,EMEA
DKV Euro Service GmbH & Co. KG,Transportation,Germany,['VR Voice GmbH'],"Robert Trojan, Team Manager Workplace and Network Services, DKV Euro Service",https://www.genesys.com/customer-stories/dkv/,EMEA
Probe Group,Business process outsourcing,"Australia, New Zealand and the Philippines",,"Rohan Khanna, CTO, Probe Group",https://www.genesys.com/customer-stories/probe-group/,APAC
eFinancial,Insurance,U.S.,,"Paul Bourdeaux, Chief Information Officer, Vericity (Fidelity Life Association and eFinancial)",https://www.genesys.com/customer-stories/efinancial/,
PATLive,Business process outsourcing,US,,"Jackie Gonzalez, Vice President, Operations, PATLive",https://www.genesys.com/customer-stories/patlive/,
Northumbrian Water Limited,Utilities,UK,['Connect'],"David Halliday, IS Product Manager, Northumbrian Water Limited",https://www.genesys.com/customer-stories/northumbrian-water/,EMEA
Pluxee,Human resources,France with global operations,,"Thibault Guerard, VP of Customer Experience and Care, Pluxee",https://www.genesys.com/customer-stories/pluxee/,EMEA
,,,,,https://www.genesys.com/customer-stories/mybudget/,APAC
Heineken Mexico,Food and Beverage,Mexico,"['Sixbell', 'Tethr It Now']","Edgar Muñoz Hernández, Head of Analytics and Support, Heineken Mexico",https://www.genesys.com/customer-stories/heineken-mexico/,LATAM
Sicredi,Financial services,Brazil,['Mutant'],"Camilo Calligaro, Telecommunication Services Analyst, Sicredi",https://www.genesys.com/customer-stories/sicredi/,LATAM
,,,,,https://www.genesys.com/customer-stories/dutch-lottery/,EMEA
Sage France,Business software,France with global operations,['eMite'],"Fabien Borras, Director Customer Operations, Tools, Data and Service, Sage France",https://www.genesys.com/customer-stories/sage-france/,EMEA
Pluxee Romania,Employee engagement solutions,Romania,,"Andreea Coca, CX and Quality Manager, Pluxee Romania",https://www.genesys.com/customer-stories/pluxee-romania/,EMEA
Tokopedia,Ecommerce,Indonesia,,"Rudy Dalimunthe, Senior Vice President of Customer Excellence, Tokopedia",https://www.genesys.com/customer-stories/tokopedia/,APAC
,,,,,https://www.genesys.com/customer-stories/bbva-argentina/,LATAM
American Heart Association,Nonprofit,U.S.,,"Chip Sugrue, VP Customer Strategies, American Heart Association",https://www.genesys.com/customer-stories/american-heart-association/,
,Financial,Chile,,"Mauricio Reyes Figueroa, Digital Development and Data Strategy Manager, Seyco",https://www.genesys.com/customer-stories/seyco/,LATAM
Western Sydney University,Education,Australia,['Nexon Asia Pacific'],"Scott Snyder, Chief Information and Digital Officer, Western Sydney University",https://www.genesys.com/customer-stories/western-sydney-university/,APAC
Security Bank,Financial,Philippines,,"Lucose Eralil, Head of Enterprise Technology and Operations",https://www.genesys.com/customer-stories/security-bank/,APAC
O2E Brands,Home services,Canada,,"Michael Downing, Vice President, Business Operations, O2E Brands",https://www.genesys.com/customer-stories/o2e-brands/,
Aeroporti di Roma,Travel,Italy,['ComApp'],"Marco Dottore, Head of Network and Infrastructure Project Management, Aeroporti di Roma",https://www.genesys.com/customer-stories/aeroporti-di-roma/,EMEA
Twiddy & Company,Property rental,United States,,"Blake Stockslager, CIO, Twiddy & Company",https://www.genesys.com/customer-stories/twiddy-company/,
Rabobank,Financial services,The Netherlands with global operations,"['24sessions', 'Microsoft']","Thom Kokhuis, Head of Conversational Banking, Rabobank",https://www.genesys.com/customer-stories/rabobank/,EMEA
,,,,,https://www.genesys.com/customer-stories/quinstreet/,LATAM
Schneider Electric,Energy,France and more than 100 countries globally,,"Irina Zubova, Vice President, Digital Sales and Customer Support Enablement, Schneider Electric",https://www.genesys.com/customer-stories/schneider-electric/,EMEA
Edenred Mexico,Prepaid services,Mexico,,"Aurelie Bagard, Director of Distant Sales, Edenred Mexico",https://www.genesys.com/customer-stories/edenred/,LATAM
Lowell Norway,Financial services,Norway,['Advania'],"Carl-Petter Udvang, Product Manager, Lowell Norway",https://www.genesys.com/customer-stories/lowell-norway/,EMEA
Stanley Steemer,Cleaning services,US,,"John Parente, Director of Contact Center Operations, Stanley Steemer",https://www.genesys.com/customer-stories/stanley-steemer/,
Uplift Inc.,Travel fintech,US,['InflowCX'],"Chrissy Vining, Director of Customer Success, Uplift",https://www.genesys.com/customer-stories/uplift/,
Western Governors University,Education,US,,"Adam Davis, Vice President of Operations, Western Governors University",https://www.genesys.com/customer-stories/western-governors-university/,
Graphic Solutions Group (GSG),Graphics equipment and consumables,US,['Mediu'],"Lauren Forte, Director of Inside Sales, Graphic Solutions Group",https://www.genesys.com/customer-stories/gsg/,
AdaptHealth,Healthcare,US,,"Bill Lewis, Senior Director, Infrastructure and Security Engineering, AdaptHealth",https://www.genesys.com/customer-stories/adapthealth/,
King Price Insurance,Financial services,South Africa,['Connect'],"Bianca Nel, Product Owner, King Price Insurance",https://www.genesys.com/customer-stories/king-price-insurance/,EMEA
,Food delivery,Thailand,,"Preeyapat Rujum, Head of Customer Fulfillment, Purple Ventures Limited",https://www.genesys.com/customer-stories/robinhood/,APAC
,,,,,https://www.genesys.com/customer-stories/sureway/,APAC
Utility Warehouse,Home services and utilities,UK,,"Samit Patel, Head of Portfolio, Utility Warehouse",https://www.genesys.com/customer-stories/utility-warehouse/,EMEA
Legrand,Industrial,"France, with global operations",,"David Gonzalez, Customer Relations Center Manager, Legrand France",https://www.genesys.com/customer-stories/legrand/,EMEA
Westpac New Zealand,Financial services,New Zealand,,"Jason Lock, Head of Contact Centers, Westpac NZ",https://www.genesys.com/customer-stories/westpac/,APAC
SITA,Air transportation,Global,,"Vichaig Douangpaseuth, Senior Manager, Service Improvement SDN Network and Voice Practice, SITA",https://www.genesys.com/customer-stories/sita/,EMEA
Atomy,Retail,South Korea,,"SungHoon Choi, IT Manager , Atomy",https://www.genesys.com/customer-stories/atomy/,APAC
Coca-Cola Bottlers’ Sales and Services,Beverage manufacturer/retailer,US,"['Help Lightning', 'Mindful Feedback', 'PCI Pal', 'Salesforce']","Nicole Thomas, VP, Customer Care Center, Coca-Cola Bottlers’ Sales and Services",https://www.genesys.com/customer-stories/coca-cola-bottlers-sales-and-services/,
,,,,,https://www.genesys.com/customer-stories/actavo/,EMEA
Quicken,Financial services,United States,,"Ian Roberts, Operations Leader, Quicken",https://www.genesys.com/customer-stories/quicken/,
Bolsa de Valores de Colombia (bvc),Financial,Colombia,,"Diego Galindo Hernández, Director of Customer Service, bvc",https://www.genesys.com/customer-stories/bolsa-de-valores-de-colombia/,LATAM
National Domestic Violence Hotline,Nonprofit,US,"['AWS', 'PureInsights']","Marty Hand, CTO, The Hotline",https://www.genesys.com/customer-stories/national-domestic-violence-hotline/,
,,,,,https://www.genesys.com/customer-stories/feros-care/,APAC
Xerox,Workplace technology,US,,"Naresh Shanker, CTO, Xerox",https://www.genesys.com/customer-stories/xerox/,
Cathay Pacific,Travel and aviation,Hong Kong,"['Accenture', 'Google Cloud']","Kenneth Lee, General Manager, IT Solutions, Cathay Pacific",https://www.genesys.com/customer-stories/cathay-pacific/,APAC
Fonterra,Dairy processing and nutrition,New Zealand and global,['Pyrios'],"Melanie Tuck, Manager, Farm Source Service Center, Fonterra",https://www.genesys.com/customer-stories/fonterra/,APAC
CarTrawler,Travel,Ireland,['DigitalWell'],"James Waghorn, Director, Customer Contact, CarTrawler",https://www.genesys.com/customer-stories/cartrawler/,EMEA
Xiaomi Corporation,Consumer electronics and hardware,China,,"Wang Chuanpeng, International Services Product Director, Xiaomi Corporation",https://www.genesys.com/customer-stories/xiaomi-corporation/,APAC
,,,,,https://www.genesys.com/customer-stories/lolivier/,EMEA
Dental Axess,Healthcare,"Switzerland, with global operations",['TechneValue'],"Patricia Zoller, Marketing Manager, Dental Axess",https://www.genesys.com/customer-stories/dental-axess/,EMEA
TOT Public Company Limited,Telecommunications,Thailand,,,https://www.genesys.com/customer-stories/tot-public-company-limited/,APAC
Kiwibank,Financial services,New Zealand,"['Spark NZ', 'AWS']","Emma Noble-Beasley, General Manager Contact Center, Kiwibank",https://www.genesys.com/customer-stories/kiwibank/,APAC
JPIMedia,Marketing and advertising,UK,['Kerv'],"Rebekah Avill, Head of Commercial Systems, JPIMedia",https://www.genesys.com/customer-stories/jpimedia/,EMEA
The Trevor Project,Nonprofit,US,,"Peggy Rajski (she/her), Co-Founder and Interim CEO, The Trevor Project",https://www.genesys.com/customer-stories/the-trevor-project/,
Humm Group,Fintech,Australasia,['Datacom'],"Andrew Murrell, Chief Operations Officer, Humm Group",https://www.genesys.com/customer-stories/humm-group/,APAC
Ilumno,Education,Colombia,['CrossNet'],"Jaume Cascales Muñoz, Director of IT Operations, Ilumno",https://www.genesys.com/customer-stories/ilumno/,LATAM
Nuuday,Telco/IT service provider,Denmark,['Netdesign'],"Michael Stinner, Head of CX Operations, Nuuday",https://www.genesys.com/customer-stories/nuuday/,EMEA
RedSalud,Healthcare,Chile,,"Juan Neme, Digital Patient Services Manager, RedSalud",https://www.genesys.com/customer-stories/redsalud/,LATAM
PureGym,Health and fitness,UK and international,['Kerv'],"Scott Adams, Member Services Manager, PureGym",https://www.genesys.com/customer-stories/puregym/,EMEA
Leroy Merlin,Retail,Europe,['Bizmatica'],"Edoardo Messinese, IT Manager, Sales and Marketing, Leroy Merlin",https://www.genesys.com/customer-stories/leroy-merlin/,EMEA
Co-op Group,Retail,United Kingdom,['IPI'],"Claire Carroll, Head of Sales and Service, Co-op Group",https://www.genesys.com/customer-stories/co-op-group/,EMEA
Woolworths Finance Shared Services,Financial Services,Australia,,"Robert Fellowes, Customer Focused Transactions Services Lead, Woolworths",https://www.genesys.com/customer-stories/woolworths-finance-shared-services/,APAC
FCT,Real estate tech and title insurance,Canada,,"Pat Smolak, Director Operations, Residential Solutions, FCT",https://www.genesys.com/customer-stories/fct/,
Paul Hartmann AG,International manufacturer of medical and hygiene products,"Heidenheim an der Brenz, Swabia, Germany",['Deliberate'],"Project Manager, Paul Hartmann AG",https://www.genesys.com/customer-stories/paul-hartmann/,EMEA
Siemens Healthineers,Healthcare and life sciences,Germany with global operations,['Cognizant'],"Jochen Hostalka, Senior Vice President IT, Siemens Healthineers",https://www.genesys.com/customer-stories/siemens-healthineers/,EMEA
Auto Trader,Automotive,UK,"['PCI Pal', 'PureInsights', 'Zendesk']","Mike Braid, Head of Enterprise IT, Auto Trader",https://www.genesys.com/customer-stories/auto-trader/,EMEA
Virgin Atlantic,Airline,UK with global operations,,"Louise Phillips, VP Customer Centers, Virgin Atlantic",https://www.genesys.com/customer-stories/virgin-atlantic/,EMEA
QBE,Insurance,Australia and global,['Daisee'],"Scott Paterson, Global Unified Comms and Collaborating Manager, QBE",https://www.genesys.com/customer-stories/qbe/,APAC
Deutsche Glasfaser,Telecommunications,"Borken, Germany",,"Peter Basse, Head of Workforce Management, Deutsche Glasfaser Wholesale GmbH",https://www.genesys.com/customer-stories/deutsche-glasfaser/,EMEA
Pihlajalinna,Healthcare services,Finland,,"Sanna Sarvijärvi, Service Director, Pihlajalinna",https://www.genesys.com/customer-stories/pihlajalinna/,EMEA
,,,,,https://www.genesys.com/customer-stories/al-romansiah/,EMEA
Grupo Vanti,Energy,Colombia,"['Google Cloud', 'Global Network Solutions']","Rolando Bermúdez, Manager of Implementation and Customer Support, Grupo Vanti",https://www.genesys.com/customer-stories/grupo-vanti/,LATAM
Independent Health,Healthcare,US,['Call Journey'],"Amanda Prell, Director, Contact Center Experience, Independent Health",https://www.genesys.com/customer-stories/independent-health/,
Conrad Electronic SE,Electronics and technology retailer,Germany,['NTT'],"Günther Oberhofer, Director IT Communication and Networks, Conrad Electronic",https://www.genesys.com/customer-stories/conrad-electronic/,EMEA
,Government,US,['Google Cloud'],"Nichole Conway, Program Manager, Missouri Department of Social Services",https://www.genesys.com/customer-stories/missouri-department-of-social-services/,
Carestream Dental,Healthcare,US,['eMite'],"Brian Harris, Director, Americas Remote Support, Carestream Dental",https://www.genesys.com/customer-stories/carestream-dental/,
Bitkub Exchange,Blockchain and cryptocurrency,Thailand,,"Chantika Chomchome, Deputy CEO and Chief People Officer, Bitkub Exchange",https://www.genesys.com/customer-stories/bitkub-exchange/,APAC
IONOS,IT services,Germany with global operations,,"Carolin Raezer, Head of Strategy and Innovation, IONOS",https://www.genesys.com/customer-stories/ionos/,EMEA
Nexon Asia Pacific,IT and services,Australia,,"Malcolm Green, Senior Contact Center Engineer, Nexon",https://www.genesys.com/customer-stories/nexon-asia-pacific/,APAC
Service NSW,Government,Australia,,"Sue Ferguson, Director of Contact Centers, Service NSW",https://www.genesys.com/customer-stories/service-nsw/,APAC
,,,,,https://www.genesys.com/customer-stories/diabetes-victoria/,APAC
,,,,,https://www.genesys.com/customer-stories/vivonet/,
FirstCare,Human Resource management,UK,,"John Coyne, Head of IT, Data and Compliance, FirstCare",https://www.genesys.com/customer-stories/firstcare/,EMEA
Lighthouse Works,Business process outsourcing,US,,"Kyle Johnson, President and Chief Executive Officer, Lighthouse Works",https://www.genesys.com/customer-stories/lighthouse-works/,
Housing Direct,Local government,Australia,['Datacom'],"Tracy Thompson, Manager, Housing Direct",https://www.genesys.com/customer-stories/housing-direct/,APAC
,,,,,https://www.genesys.com/customer-stories/optimind-winter/,EMEA
,,,,,https://www.genesys.com/customer-stories/rose-hulman-institute-of-technology-askrose-homework-help/,
Telefoonaanname.nl,Business process outsourcing,Netherlands,,"Edwin Smit, Co-founder and Owner, Telefoonaanname.nl",https://www.genesys.com/customer-stories/telefoonaanname-nl/,EMEA
Lyreco,Retail,"France, with global operations",,"Nelson Oliveira, Product Owner, Customer Care, Lyreco",https://www.genesys.com/customer-stories/lyreco-group/,EMEA
Electrolux Group,Manufacturing and retail,Sweden and global,['Google Cloud'],"Mateusz Jazdzewski, Head of IT Consumer Solutions and Head of CX Product at Electrolux Group, Electrolux Group",https://www.genesys.com/customer-stories/electrolux-group/,EMEA
Spark,Telecommunications,New Zealand,,"James Palmer-Dale, Chapter Lead of Customer Engagement Solutions, Spark",https://www.genesys.com/customer-stories/spark/,APAC
Tokio Marine Management Australasia,Travel insurance,Australia,,"Aaron Roche, Travel Manager, Operations, Tokio Marine Management Australasia",https://www.genesys.com/customer-stories/tokio-marine-management-australasia/,APAC
Field Management Ireland,Business process outsourcer,Ireland,,"Rosemary Wynne, Digital Marketing Director, Field Management Ireland",https://www.genesys.com/customer-stories/field-management-ireland/,EMEA
ACEA,Utilities,Italy,,"Ivan Vigolo, Group Chief Innovation & Information Officer, ACEA",https://www.genesys.com/customer-stories/acea/,EMEA
Benify,HR technology,Sweden and global operations,['Salesforce'],"Philip Hagenfeldt, Commercial System Lead, Benify",https://www.genesys.com/customer-stories/benify/,EMEA
Etraveli Group,Travel and tourism,Sweden,"['GlobalConnect', 'Amelia', 'Scorebuddy', 'Shelf']","Gurpreet Sawhney, WFM Director, Etraveli Group",https://www.genesys.com/customer-stories/etraveli/,EMEA
Banco Solidario,Financial services,Ecuador,"['Seteinfo', 'Aivo (AgentBot)']","Damián Cruz, Digital Channel Consultant, Banco Solidario",https://www.genesys.com/customer-stories/banco-solidario/,LATAM
Fanatics,Retail,US with global operations,,"Nigel Ponds, Senior Director, Global Resource Planning and Telephony , Fanatics, Inc.",https://www.genesys.com/customer-stories/fanatics/,
HELPLINE,IT services,France,,"Lionel Florence, Director Users Digital Journeys, HELPLINE",https://www.genesys.com/customer-stories/helpline/,EMEA
,,,,,https://www.genesys.com/customer-stories/nahdi-medical-company/,EMEA
,,,,,https://www.genesys.com/customer-stories/ignite-travel-group/,APAC
Bankaya,Financial services,Mexico,['Crossnet'],"Adrian Soria, Collections Manager, Bankaya",https://www.genesys.com/customer-stories/bankaya/,LATAM
CallPageboy,Business process outsourcer,Ireland,,"Ken Colley, Managing Director, CallPageboy",https://www.genesys.com/customer-stories/callpageboy/,EMEA
Anglicare Sydney,Non-profit,Australia,"['QPC', 'Call Journey']","Roy Hazelwood, Contact Center Manager, Anglicare Sydney",https://www.genesys.com/customer-stories/anglicare-sydney/,APAC
Fremtind Service,Government (Transportation),Norway,,"Richard Vogt, Operations Manager, Fremtind Service",https://www.genesys.com/customer-stories/fremtind-service/,EMEA
SV Gruppe,Media and digital services,Germany,['infinit.cx'],"Manuela Lüdke, Managing Director, SV Dialog GmbH & Co. KG",https://www.genesys.com/customer-stories/sv-gruppe/,EMEA
B&O Service,Housing,Germany,['Deliberate'],"Christoph Otto, Head of IT Infrastructure and Service, B&O Service",https://www.genesys.com/customer-stories/bo-service/,EMEA
Ethiopian Airlines,Aviation and travel,Ethiopia,,"Getinet Tadesse, CIO, Ethiopian Airlines",https://www.genesys.com/customer-stories/ethiopian-airlines/,EMEA
Cegid,SaaS solutions,"France, with global operations",,"Thierry Galvagni, CIO, Cegid",https://www.genesys.com/customer-stories/cegid/,EMEA
Modivcare,Healthcare,US,['Amazon Web Services'],"Heath Sampson, President & CEO, Modivcare",https://www.genesys.com/customer-stories/modivcare/,
Unisys,IT services,US,"['Microsoft', 'Google Cloud', 'ServiceNow']","Aron Meyer, Solution Architect, Digital Workplace Solutions, Unisys",https://www.genesys.com/customer-stories/unisys/,
Digicall Assist,Automotive,Australia,['Synergy Enterprise Solutions'],"Rebecca Goss, Contact Center Operations Manager, Digicall Assist",https://www.genesys.com/customer-stories/digicall-assist/,APAC
Carglass®,Vehicle glass repair and replacement,Germany,,"Brice-Willys Tebiro, Innovation and Improvement Manager, Carglass Germany",https://www.genesys.com/customer-stories/carglass/,EMEA
BAC,Financial services,Central America,['ESMT'],"Cinthya Moreno Gómez, Service Channels Corporate Director, BAC",https://www.genesys.com/customer-stories/bac/,LATAM
,,,,,https://www.genesys.com/customer-stories/bis-contact-center/,LATAM
Alight Solutions,IT services,US,,"Robin Vallango, Vice President, Customer Care Technology, Alight Solutions",https://www.genesys.com/customer-stories/alight-solutions/,
Bedfordshire Pilgrim Housing Association (BPHA),Housing provider and developer,UK,['Email Wizard'],"Lianne Martindale, Communications Center Manager, BPHA",https://www.genesys.com/customer-stories/bpha/,EMEA
Universal Assistance,Traveler assistance services,Latin America,['In Motion'],"Raffaele Loiacono, Latin America CIO, Universal Assistance",https://www.genesys.com/customer-stories/universal-assistance/,LATAM
Narayana Health,Healthcare,India,"['Tata Communications', 'Salesforce']","Kumar KV, Group Chief Information Officer, Narayana Health",https://www.genesys.com/customer-stories/narayana-health/,APAC
Blibli,eCommerce,Indonesia,,"Shanty Cantya, Vice President of Customer Management, Blibli",https://www.genesys.com/customer-stories/blibli/,APAC
City of Clearwater (Utility Customer Service Division),Government,US,,"Amy Sessions, Customer Service Division Manager, City of Clearwater",https://www.genesys.com/customer-stories/city-of-clearwater/,
CarGarantie Courtage SARL,Insurance broker and service provider,France,['Deliberate'],"Christoph Schuler, Head of Operations, CarGarantie Courtage SARL",https://www.genesys.com/customer-stories/cargarantie/,EMEA
Round Room,Retail,US,,"Ryan Ervin, Senior Director, Customers for Life, TCC Round Room",https://www.genesys.com/customer-stories/round-room/,
Fibrus Networks,Telecommunications,Northern Ireland and UK,['Kerv Experience'],"Stephen Riley, Head of Customer Service Operations, Fibrus Networks",https://www.genesys.com/customer-stories/fibrus-networks/,EMEA
Somerset Council,Local government,UK,"['Kerv', 'Amazon Web Services']","Sharon Passmore, Service Manager, Customer Services, Somerset Council",https://www.genesys.com/customer-stories/somerset-council/,EMEA
"Edenred Brazil — Ticket Log, Repom and Edenred Pay brands",Payment services,Brazil,"['Alctel', 'IBM']","Jéssica Mallach, Continual Improvement Coordinator, Ticket Log",https://www.genesys.com/customer-stories/edenred-brazil/,LATAM
,Insurance,Australia,"['Telstra', 'CVT']","Sheridan Francis, Manager, Regional Operations Center, Aioi Nissay Dowa Insurance Company Australia",https://www.genesys.com/customer-stories/aioi-nissay-dowa-insurance/,APAC
,,,,,https://www.genesys.com/customer-stories/kiwi-com/,EMEA
,,,,,https://www.genesys.com/customer-stories/gaitame-com/,APAC
Localsearch,Digital marketing,Australia,,"Gary Mandelkow, Chief Technology Officer, Localsearch",https://www.genesys.com/customer-stories/localsearch/,APAC
Hexaware,IT/Business process outsourcer,India,,"Kalpesh Gandhi, VP of OCX Service Delivery, Hexaware",https://www.genesys.com/customer-stories/hexaware/,APAC
Countdown New Zealand,Retail,New Zealand,,"Steve James, Head of Technology, Countdown New Zealand",https://www.genesys.com/customer-stories/countdown-new-zealand/,APAC
Arvato CRM Solutions,Customer Services and Business Process Outsourcing,UK,['Kerv'],"Gordon Dalgleish, Head of IT Solutions, Arvato CRM Solutions",https://www.genesys.com/customer-stories/arvato/,EMEA
Prvidr,Software,Australia,,"Lawrence Drayton, Head of Customer Experience, Prvidr",https://www.genesys.com/customer-stories/prvidr/,APAC
Eesti Energia (also known as Enefit),Energy,"Estonia, Latvia, Lithuania, Poland and Finland",['Adventus Solutions'],"Kaido Kabral, Customer Service Solution Expert, Eesti Energia",https://www.genesys.com/customer-stories/eesti-energia/,EMEA
Maxicare,Healthcare,Philippines,,"Christian Argos, CEO, Maxicare",https://www.genesys.com/customer-stories/maxicare/,APAC
BetFlag,Online gambling,Italy,['TechneValue'],"Domenico Galizia, CEO, BetFlag",https://www.genesys.com/customer-stories/betflag/,EMEA
3 Denmark,Telecommunications,Denmark,['Advania'],"Jonas Kristensen, Business Optimisation Manager, 3 Denmark",https://www.genesys.com/customer-stories/3-denmark/,EMEA
BancoEstado,Financial services,Chile,,"Luis Chávez Tuesta, Head of Software and Product Development, BancoEstado",https://www.genesys.com/customer-stories/bancoestado/,LATAM
Multilaser,Manufacturing and retail,Brazil,['Survey Dynamix'],"Leonardo Castilho, Head eCommerce, After-sales and Digital Marketing, Multilaser",https://www.genesys.com/customer-stories/multilaser/,LATAM
eco24,Debt consulting,Germany,['Deliberate'],"Hans-Jörg Fadda, Managing Director, eco24",https://www.genesys.com/customer-stories/eco24/,EMEA
Maximus,Business process outsourcer,US with global operations,['Amazon Web Services'],"Angela Kovach, Vice President of Cloud Technology, Maximus",https://www.genesys.com/customer-stories/maximus/,
Beyond Bank,Financial services,Australia,['QPC'],"Brent Alexander, National Manager, Customer Relationship Center, Beyond Bank",https://www.genesys.com/customer-stories/beyond-bank/,APAC
O.phon GmbH,Business consulting services,Germany,['NTT'],"Daniel Kubein, Head of Operations and Performance, O.phon GmbH",https://www.genesys.com/customer-stories/o-phon/,EMEA
Dolfi1920,Aviation,Poland,,"Tal Fridman, Operations and Business Development Director Europe, Dolfi1920",https://www.genesys.com/customer-stories/dolfi1920/,EMEA
Grupo Sabin,Healthcare,Brazil,['InvenIT'],"Neilton Alves, Project Analyst, Grupo Sabin",https://www.genesys.com/customer-stories/grupo-sabin/,LATAM
Inter,Financial Services,Brazil,,"João Marcus Santos, IT Manager, Inter",https://www.genesys.com/customer-stories/inter/,LATAM
Odity,Customer relations,Global,,"Clément Polet, Deputy CEO Business, Odity",https://www.genesys.com/customer-stories/odity/,EMEA
Digital Dialog GmbH,Contact center services,Germany,['VR Voice'],"Corinna Kaussen, Authorized Signatory, Digital Dialog GmbH",https://www.genesys.com/customer-stories/digital-dialog/,EMEA
Company Nurse,Healthcare,US,['Brightmetrics'],"Henry Svendblad, CTO, Company Nurse",https://www.genesys.com/customer-stories/company-nurse/,
APM,Human resources,Australia,['Customer Driven'],"Michael McBride, General Manager, Customer Service Center, APM",https://www.genesys.com/customer-stories/apm/,APAC
,,,,,https://www.genesys.com/customer-stories/rapid-financial-solutions/,
Brighton & Hove Albion Football Club,Sports and entertainment,UK,['Kerv'],"Brian Kearney, Digital Systems Project Manager, Brighton & Hove Albion Football Club",https://www.genesys.com/customer-stories/brighton-and-hove-albion-football-club/,EMEA
Universidad Tecnologica de México (UNITEC),Education,Mexico,,"Leandro Cruz Hernández, Digital Director and Customer Experience, UNITEC",https://www.genesys.com/customer-stories/unitec/,LATAM
